<?xml version="1.0" encoding="UTF-8"?>
<rapport xmlns:xsi="http://www.w3.org/2001/XMLSchema-instance"
    xsi:noNamespaceSchemaLocation="file:/C:/Users/hp/Downloads/videos%20cours%20youtube/XML/Exemples%20XML/Mondat/mandat.xsd">
    <mandat num="7124536" date="2007-10-10" montant="1000" etat="RECU">
        <expediteur cin="A12345" nom="Slimani" prenom="Youssef" ville="Casa"/>
        <destinateur cin="P98654" nom="Hassouni" prenom="Laila" ville="Fes"/>
    </mandat>
    <mandat num="7124537" date="2007-11-11" montant="3200" etat="NON RECU">
        <expediteur cin="M12345" nom="Alaoui" prenom="Mohamed" ville="Marakech"/>
        <destinateur cin="M92654" nom="Alaoui" prenom="Imane" ville="Fes"/>
    </mandat>
    <mandat num="7124538" date="2008-07-08" montant="500" etat="NON RECU">
        <expediteur cin="H123222" nom="Qasmi" prenom="Slim" ville="Oujda"/>
        <destinateur cin="B91154" nom="Qasmi" prenom="Hassan" ville="Rabat"/>
    </mandat>
</rapport>